category_id,category_name,description,picture
1,Beverages,"Soft drinks, coffees, teas, beers, and ales",<memory at 0x000001C31DD687C0>
2,Condiments,"Sweet and savory sauces, relishes, spreads, and seasonings",<memory at 0x000001C32F2ADFC0>
3,Confections,"Desserts, candies, and sweet breads",<memory at 0x000001C32F2AD780>
4,Dairy Products,Cheeses,<memory at 0x000001C32F2ADE40>
5,Grains/Cereals,"Breads, crackers, pasta, and cereal",<memory at 0x000001C32F2ADC00>
6,Meat/Poultry,Prepared meats,<memory at 0x000001C32F2AE5C0>
7,Produce,Dried fruit and bean curd,<memory at 0x000001C32F2AE440>
8,Seafood,Seaweed and fish,<memory at 0x000001C32F2AE500>
